Dateiname;Gefundene Elemente;Beste Iteration;Diff-Score;FehlerProPixel
AC0811_S.jpg;SEMANTIC: Kreis ohne Buchstabe + SEMANTIC: senkrechter Strich hinter dem Kreis;1;9.30;0.02479644
AC0814_S.jpg;SEMANTIC: Kreis ohne Buchstabe + SEMANTIC: waagrechter Strich rechts vom Kreis;1;8.33;0.02220800
AC0837_L.jpg;SEMANTIC: waagrechter Strich links vom Kreis + SEMANTIC: Kreis + Buchstabe;1;17.79;0.01581511
AC0839_L.jpg;SEMANTIC: waagrechter Strich rechts vom Kreis + SEMANTIC: Kreis + Buchstabe;1;16.78;0.01491595
AC0881_S.jpg;SEMANTIC: senkrechter Strich hinter dem Kreis + SEMANTIC: Kreis + Buchstabe;1;10.56;0.02815289
AC0882_L.jpg;SEMANTIC: waagrechter Strich links vom Kreis + SEMANTIC: Kreis + Buchstabe;1;11.07;0.00984336
